{"$schema": "uefn.handoff.v1", "handoff_id": "H-DESIGN-006", "from": "Narrative_Designer", "to": ["Writer_Scenariste", "Level_Designer", "Producer_Orchestrator"], "artifact": "01_lore.json", "mission_ref": "M-CORPOPLAZA-DESIGN-06", "summary_short": "Memorial Park : parc de memoire paye par les tours. 5 faits sources, 4 couches, 3 regles, 2 silences. Ni replique ni coordonnee.", "payload": {"univers": {"nom_projet": "Corpo Plaza - Memorial Park", "lieu": "bassin, trois anneaux, tours", "periode": "UNKNOWN", "etat_au_t0": "arrivee au sud, regard au nord, rien demande", "ce_que_ce_nest_pas": "ni memorial d'etat ni culte"}, "high_concept": "Parc de memoire au pied des tours : bassin immobile, cerisiers, socle central. On commemore sans nommer, la ville vend.", "faits_etablis": [{"id": "F1", "fait": "Le nom du projet porte la commemoration.", "source": "01_gdd.json", "fiabilite": "fact_amont"}, {"id": "F2", "fait": "Scene contemplative, sans Verse.", "source": "01_gdd.json", "fiabilite": "fact_amont"}, {"id": "F3", "fait": "Cerisier retenu pour le memorial park.", "source": "01_gdd.json", "fiabilite": "fact_amont"}, {"id": "F4", "fait": "Bassin = fontaine sans eau.", "source": "01_gdd.json", "fiabilite": "fact_amont"}, {"id": "F5", "fait": "Qui est honore : UNKNOWN.", "source": "UNKNOWN", "fiabilite": "UNKNOWN"}], "regles_d_univers": [{"id": "R1", "regle": "On commemore au pied des tours, pas sur une colline.", "portee": "diegetique", "source": "01_gdd.json", "statut": "deduite_d_un_fait"}, {"id": "R2", "regle": "Ce qui est honore reste anonyme.", "portee": "representation", "source": "UNKNOWN", "statut": "proposition_non_adosee"}, {"id": "R3", "regle": "Aucune mecanique ne se deduit du lore.", "portee": "interdit_de_forme", "source": "01_gdd.json", "statut": "contrainte_de_pipeline"}], "couches_de_lecture": [{"id": "C1", "zone_id": "Zone_South", "niveau": "premiere_lecture", "ce_qu_on_voit": "entree, bornes, tours", "ce_que_ca_raconte": "on sort de la circulation.", "verif_par": "capture au temps 0 au sud"}, {"id": "C2", "zone_id": "Zone_Center", "niveau": "premiere_lecture", "ce_qu_on_voit": "bassin, anneaux, socle", "ce_que_ca_raconte": "deuil : cercle qu'on contourne.", "verif_par": "capture plongeante"}, {"id": "C3", "zone_id": "Zone_North", "niveau": "premiere_lecture", "ce_qu_on_voit": "tour dominante", "ce_que_ca_raconte": "ce qui surplombe domine.", "verif_par": "capture oblique"}, {"id": "C4", "zone_id": "Zone_SE_South", "niveau": "detail_reperable", "ce_qu_on_voit": "bancs, cerisier", "ce_que_ca_raconte": "deuil quotidien.", "verif_par": "inventaire des assets"}], "intention_implantation": [{"id": "I1", "zone_id": "Zone_Center", "intention": "Le socle doit rester lisible depuis le sud, sans device.", "fait_lie": "F4", "tranche_par": "Level_Designer"}], "silences_voulus": [{"id": "S1", "sujet": "qui est honore", "raison": "le nommer inventerait un deuil", "statut": "a_arbitrer_par_producer"}, {"id": "S2", "sujet": "ce que decident les tours", "raison": "quete deguisee.", "statut": "silence_tenu"}], "ce_qu_on_ne_raconte_pas": ["ni vengeance ni enquete", "ni disparu nomme", "ni complot"], "continuite_avec_vision": {"statut": "non_verifiee", "vision_ref": "UNKNOWN", "rationale": "00_vision.json non emis : DA inverifiable."}, "contradictions_levees": [{"id": "K1", "source_a": "journal_run", "source_b": "01_gdd.json", "constat": "journal : orange a l'ouest ; GDD : Zone_East", "arbitrage": "alignement sur le GDD.", "statut": "remontee_producer"}], "zones_non_couvertes": [{"zone_id": "Zone_SW_South", "motif": "angle sans couche : le lore suit l'axe sud-nord, pas les approches de biais"}, {"zone_id": "Zone_NW_North", "motif": "a l'ouest de la dominante, aucun recit attache"}, {"zone_id": "Zone_NE_North", "motif": "a l'est de la dominante, aucun recit attache"}, {"zone_id": "Zone_West", "motif": "couche de l'enseigne cyan retiree par la troncature de l'exemple, pas par decision"}, {"zone_id": "Zone_East", "motif": "couche de l'enseigne orange retiree par la troncature, arbitrage koi en cours (K1)"}], "gate_hitl": {"numero": 2, "statut": "PENDING", "arbitre_par": "Producer_Orchestrator", "iterations": 0}}, "constraints": {"acces_mcp": "none", "must_preserve": ["aucune mecanique deduite du lore", "anonymat du memorial"], "forbidden": ["pas de replique (07)", "pas de coordonnee, asset ou device"]}, "golden_example_ref": "skill/exemples/lore-corpo-plaza-memorial-park.json", "acceptance": ["high_concept_present_max_400_chars", "facts_min_5_each_with_source_or_unknown", "fact_without_source_declared_unknown_not_fictionalized", "no_fact_contradicts_amont_artifacts", "universe_rules_min_3", "reading_layers_min_4_each_on_zone_id", "all_zone_ids_declared_in_01_gdd", "spatial_facts_written_as_implantation_intent", "silences_declared_min_2", "anti_narrative_exclusions_min_3", "continuity_with_vision_declared", "contradictions_listed_with_arbitrage", "uncovered_zones_declared", "no_coordinates_no_asset_path_no_device", "no_replica_no_mission_no_topology", "design_gate_hitl_2_pending"], "next_step_hint": "07 : ecrire dans l'anonymat. 09 : l'intention se resout sur la grille.", "context_budget_tokens": 4000, "exemple_annotations": {"role": "GOLDEN - forme attendue de 01_lore.json", "source": "Artefact NON EMIS pendant la run (limitee a la geometrie) ; payload reconstitue depuis 01_gdd.json et le journal 2026-10-24 (s.2 decisions, s.13 gate holo). 00_vision.json non emis.", "tronque": "Tronque pour tenir sous 5 Ko : source_detail, impact_en_aval, exploite_par, must_ask_producer, consequence omis ; 1 intention sur la serie, 1 contradiction ; couche des deux enseignes retiree. Les 16 criteres d'acceptation restent tous revendiques : aucun retire pour faire renter la troncature. Les deux zones d'enseigne sont donc declarees dans zones_non_couvertes avec un motif qui nomme la cause (troncature de l'exemple, pas une decision du lore), pour que le compte 4 couchees + 5 non couchees = 9 zone_id du GDD reste verifiable.", "regle_de_troncature": "Un golden qui ampute sa liste d'acceptation pour que ses donnees rentrent enseigne la triche, pas le format. Quand la troncature rend un critere faux, on repare la donnee et on en declare la cause (voir les motifs de Zone_West et Zone_East).", "pourquoi_il_passe": ["une source par fait, lacune en UNKNOWN", "4 couches sur zone_id reels avec verif_par", "spatial en intention, gate PENDING"]}}
